{
  "schemaVersion": 1,
  "meta": {
    "name": "Purview Information Protection scanner and private Azure Files lab",
    "status": "approved",
    "scope": "resourceGroup",
    "purpose": "Optional demo-only Information Protection scanner host with a private SMB share for synthetic fixtures."
  },
  "deployment": {
    "location": "parameterized",
    "existingResourceGroup": true,
    "subscriptionTargetAuthorized": false
  },
  "network": {
    "addressSpace": "10.40.0.0/16",
    "vmSubnet": "10.40.1.0/24",
    "privateEndpointSubnet": "10.40.2.0/24",
    "publicIp": false,
    "inboundRdp": false,
    "inboundSmb": false,
    "filePrivateDns": "privatelink.file.core.windows.net"
  },
  "security": {
    "storageDedicated": true,
    "storagePublicAccess": false,
    "keyVaultRbac": true,
    "keyVaultPurgeProtection": true,
    "credentialOutputs": false,
    "managedIdentity": true
  },
  "resources": [
    {
      "name": "scanner-vnet, two subnets, NSG",
      "type": "Microsoft.Network/virtualNetworks",
      "apiVersion": "2023-09-01",
      "purpose": "Private VM/Private Endpoint networking and explicit HTTPS egress."
    },
    {
      "name": "scanner Windows VM, NIC, managed disk, VM extension",
      "type": "Microsoft.Compute/virtualMachines",
      "apiVersion": "2023-09-01",
      "purpose": "Windows Server Desktop Experience scanner host; no public IP; local SQL Express installed only from a pinned, hash-verified package."
    },
    {
      "name": "scanner managed identity",
      "type": "Microsoft.ManagedIdentity/userAssignedIdentities",
      "apiVersion": "2023-01-31",
      "purpose": "Read approved Key Vault values and retrieve the dedicated lab storage key at narrowly scoped resource scopes."
    },
    {
      "name": "dedicated scanner storage account and Azure Files share",
      "type": "Microsoft.Storage/storageAccounts",
      "apiVersion": "2023-05-01",
      "purpose": "TLS-protected SMB3 synthetic-content share; public network access disabled; shared-key access is isolated to this disposable demo account."
    },
    {
      "name": "Azure Files private endpoint and private DNS",
      "type": "Microsoft.Network/privateEndpoints",
      "apiVersion": "2023-09-01",
      "purpose": "Private file endpoint and DNS registration for the scanner VNet."
    },
    {
      "name": "RBAC Key Vault and private endpoint",
      "type": "Microsoft.KeyVault/vaults",
      "apiVersion": "2023-07-01",
      "purpose": "Store app credential without outputs; RBAC, soft delete, purge protection, and private DNS."
    },
    {
      "name": "least-scope scanner role assignments",
      "type": "Microsoft.Authorization/roleAssignments",
      "apiVersion": "2022-04-01",
      "purpose": "VM identity access scoped to the dedicated storage account and lab vault."
    }
  ],
  "acceptance": {
    "defaultMode": "discovery",
    "scannerReadinessRequiresScan": true,
    "activationRequiresSeparateApproval": true,
    "liveDeploymentTested": false
  }
}
